<?xml version="1.0" encoding="UTF-8" ?>
<factory xmlns:xsi="http://www.w3.org/2001/XMLSchema-instance"
            xsi:noNamespaceSchemaLocation="factory.xsd">

    <candy name="red_bogatyr">
        <wrapper>color paper</wrapper>
        <cover>chocolate</cover>
        <filler>chocolate</filler>
        <quantity>2</quantity>
    </candy>

    <candy name="black_and_white">
        <wrapper>black cellophane</wrapper>
        <cover>white chocolate</cover>
        <filler>black fondant</filler>
        <quantity>1</quantity>
    </candy>

    <candy name="karamelka">
        <wrapper>cellophane</wrapper>
        <cover>caramel</cover>
        <filler>caramel</filler>
        <quantity>6</quantity>
    </candy>

</factory>